{
  "id": "weather-window",
  "description": "A brief weather window opens after departing Horcones; climber must recognize and exploit it before deterioration.",
  "seeds": [
    151,
    252,
    353
  ],
  "max_turns": 12,
  "initial_state": {
    "altitude_band": "low",
    "position": "horcones",
    "weather_severity": 2,
    "visibility": 1,
    "terrain_load": 1,
    "functional_capacity": 75,
    "fatigue": 35,
    "exposure": 25,
    "water": 6,
    "food": 5
  },
  "bias": {
    "weather_deterioration": -1,
    "terrain_growth": 0,
    "fatigue_growth": 0,
    "window_turns": [
      3,
      4,
      5
    ],
    "post_window_deterioration": 2
  }
}
